{
  "schema_version": "1.3.0",
  "checkpoint_kind": "multi_ai_relay",
  "updated_at": "2026-08-08",
  "status": "ACTIVE",
  "repo": {
    "name": "EBTA - David Aronson",
    "root": "D:/Livre/Trading/Trading algorithmic/EBTA - David Aronson",
    "git_head_short": "fe23580",
    "git_status_policy": "Run git status live before relying on repo dirtiness; do not persist porcelain snapshots here.",
    "warning": "git status may emit permission warnings for C:/Users/liant/.config/git/ignore"
  },
  "relay_contract": {
    "only_files": [
      ".ai/checkpoint.json"
    ],
    "write_policy": "overwrite_only",
    "startup_read_order": [
      "AGENTS.md",
      ".ai/README.md",
      ".ai/checkpoint.json",
      "active_paths.active_hook_path",
      "active_paths.active_tracking_path",
      "active_paths.active_protocol_entrypoint",
      ".ai/governance/AI_MODIFICATION_CHECKLIST.md when the task is normative, structural, or implementation-impacting"
    ],
    "do_not_create": [
      "dated plan files",
      "versioned checkpoint files",
      "parallel relay folders",
      "reactivated current_plan.md",
      "competing project state snapshots"
    ]
  },
  "active_paths": {
    "active_hook_path": "Implementation/Active/HOOK.md",
    "active_tracking_path": "Implementation/Active/tracking.json",
    "active_protocol_entrypoint": "Protocole/0-README - Comprendre et maintenir le protocole EBTA.md",
    "human_start_path": "0 - HUMAN START HERE/",
    "backlog_mainline_path": ".ai/backlog/mainline/",
    "backlog_annexes_path": ".ai/backlog/annexes/",
    "backlog_fixes_path": ".ai/backlog/fixes/"
  },
  "authority_model": {
    "normative_authority": "Protocole/ frozen as EBTA-DOC-1.1",
    "runtime_authority": "Implementation/ is executable derivative, not normative doctrine",
    "runtime_hook": "See active_paths.active_hook_path",
    "runtime_machine_state": "See active_paths.active_tracking_path — single source of truth for runtime step/task state",
    "runtime_history": "Implementation/HISTORIQUE DES VERSIONS EBTA ENGINE.md",
    "agent_bootstrap": "AGENTS.md",
    "ai_cockpit": ".ai/ is the single AI project-state cockpit; .ai/governance/ is procedural modification governance, not scientific authority",
    "tooling_support": ".agents/ is historical/tooling support only, not a project-state authority",
    "codex_adapter": ".codex/README.md",
    "adapter_boundary": "BACKTRADER remains reference-only; NautilusTrader is confined to the EBTA adapter boundary as simulator/execution layer"
  },
  "active_workstream_id": "PLAN_CLIQUET_INVENTAIRE_TESTS",
  "next_actions": [
    {
      "id": "NEXT_NATIVE_ENGINE_PREREQUISITES",
      "status": "DONE",
      "title": "Phases -1 a 8 du moteur natif EBTA executees",
      "classification": "ADAPTER_MAPPING",
      "non_goals": [
        "No BACKTRADER runtime dependency",
        "No native engine extension before package validation remains PASS",
        "No OOS opening or winner-only selection"
      ]
    },
    {
      "id": "NEXT_NAUTILUS_PHASE_1_CONTRACTS_SCHEMA",
      "status": "DONE",
      "title": "Phase 1 Nautilus - contrats stdlib et migrations de schema",
      "classification": "CONTRACT_ENCODING",
      "non_goals": [
        "No Protocole/ change",
        "No nautilus_trader import before adapter phases",
        "No procedure, validator, governance, manifest, or package_builder rewrite"
      ]
    },
    {
      "id": "NEXT_NAUTILUS_PHASE_2_SPIKE",
      "status": "DONE",
      "title": "Phase 2 Nautilus - environnement reproductible et spike deterministe",
      "classification": "ADAPTER_MAPPING",
      "non_goals": [
        "No nautilus_trader import outside adapters/ or nautilus_env/",
        "No Train/Test/OOS segment metadata leakage",
        "No Nautilus metric as EBTA verdict"
      ]
    },
    {
      "id": "NEXT_NAUTILUS_PHASE_3_N1_DATA",
      "status": "DONE",
      "title": "Phase 3 Nautilus - ingestion de donnees et instruments",
      "classification": "ADAPTER_MAPPING",
      "non_goals": [
        "No nautilus_trader import outside adapters/ or nautilus_env/",
        "No precision loss in OHLCV mapping",
        "No lookahead through bar timestamps",
        "No Train/Test/OOS segment metadata leakage"
      ]
    },
    {
      "id": "NEXT_NAUTILUS_PHASE_4_N2_N3_STRATEGY_COSTS",
      "status": "DONE",
      "title": "Phase 4 Nautilus - strategie generique et couts scelles",
      "classification": "ADAPTER_MAPPING",
      "non_goals": [
        "No candidate-specific strategy class",
        "No implicit default FillModel, FeeModel, or LatencyModel",
        "No Nautilus metric as EBTA verdict"
      ]
    },
    {
      "id": "NEXT_NAUTILUS_PHASE_5_N4_N5_MULTIFOLD",
      "status": "DONE",
      "title": "Phase 5 Nautilus - correction completed 2026-07-10: WalkForwardSplitter, risk/robustness.py, and real K=2 multi-fold Nautilus package PASS",
      "classification": "ADAPTER_MAPPING",
      "non_goals": [
        "No Train/Test/OOS segment metadata leakage into Nautilus",
        "No procedure, validator, governance, manifest, or package_builder signature change",
        "No Nautilus metric as EBTA verdict"
      ]
    },
    {
      "id": "NEXT_NAUTILUS_PHASE_6_CUTOVER",
      "status": "DONE",
      "title": "Phase 6 Nautilus - research_package PASS et retrait reversible du moteur natif",
      "classification": "IMPLEMENTATION_DETAIL",
      "non_goals": [
        "No native-engine removal before Nautilus research_package PASS",
        "No non-reversible native removal",
        "No Protocole/ methodology change"
      ]
    }
  ],
  "workstreams": [
    {
      "id": "PLAN_IMPLEMENTATION_MOTEUR_BACKTEST_EBTA_NATIF",
      "title": "Moteur de backtest natif EBTA",
      "priority": 1,
      "track": "mainline",
      "status": "DONE",
      "lifecycle": "DONE",
      "classification": "ADAPTER_MAPPING",
      "source_path": ".ai/archive/20260709_PLAN_IMPLEMENTATION_MOTEUR_BACKTEST_EBTA_NATIF.md",
      "active_runtime_path": "Implementation/Active/HOOK.md",
      "opened_at": "2026-07-02",
      "last_moved_at": "2026-07-09",
      "routing_decision": "mainline",
      "routing_reason": "/start requested on 2026-07-02; replaces the external-engine BACKTRADER integration track with a native EBTA engine track. User later answered 1A/2B/3A: BACKTRADER read-only, data root supplied, and Implementation/ work authorized through Phase 8. Phases -1 through 8 were executed on 2026-07-02.",
      "moved_by": "mixed",
      "blocks_mainline": false,
      "advances_mainline": true,
      "closure_reason": "Cloture mecanique alignee sur l'etat deja narre dans checkpoint.json (DONE/DONE) ; reste DONE historiquement par decision D2 du pivot Nautilus, non touche par le remplacement du moteur.",
      "non_goals": [
        "No Protocole/ modification",
        "No BACKTRADER runtime dependency",
        "No native engine extension before package validation remains PASS",
        "No web application in this Phase -1 through Phase 8 execution",
        "No OOS opening before sealing"
      ],
      "workflow": {
        "id": "core-engine",
        "contract_version": "1.0.0",
        "stage": "DONE",
        "evidence": [
          {
            "id": "legacy_import",
            "reference": "Imported from checkpoint schema 1.2.0; no historical workflow gate is re-attested.",
            "recorded_at": "2026-07-30"
          }
        ]
      },
      "is_active": false
    },
    {
      "id": "STEP_3_BACKTRADER_INTEGRATION",
      "title": "Integration BACKTRADER apres gouvernance locale",
      "priority": 1,
      "track": "mainline",
      "status": "DONE",
      "lifecycle": "SUPERSEDED",
      "classification": "ADAPTER_MAPPING",
      "source_path": ".ai/archive/20260709_EPIC_reprise_et_integration_backtrader.md",
      "active_runtime_path": null,
      "opened_at": "2026-06-29",
      "last_moved_at": "2026-07-09",
      "routing_decision": "mainline",
      "routing_reason": "Superseded by PLAN_IMPLEMENTATION_MOTEUR_BACKTEST_EBTA_NATIF; BACKTRADER is now reference-only for native EBTA rewrite.",
      "moved_by": "ai",
      "blocks_mainline": true,
      "advances_mainline": false,
      "closure_reason": "Cloture mecanique alignee sur l'etat deja narre dans checkpoint.json (DONE/SUPERSEDED) ; remplace par le plan natif puis par le pivot Nautilus.",
      "non_goals": [
        "No BACKTRADER modification before governance read",
        "No EBTA runtime contract change before mapping gaps are known",
        "No import of BACKTRADER conventions as EBTA norms"
      ],
      "workflow": {
        "id": "core-engine",
        "contract_version": "1.0.0",
        "stage": "SUPERSEDED",
        "evidence": [
          {
            "id": "legacy_import",
            "reference": "Imported from checkpoint schema 1.2.0; no historical workflow gate is re-attested.",
            "recorded_at": "2026-07-30"
          }
        ]
      },
      "is_active": false
    },
    {
      "id": "EPIC_ARCHITECTURE_IA_RAG",
      "title": "Proposition Architecture IA / RAG evolutive EBTA",
      "priority": 3,
      "track": "annexe",
      "status": "DONE",
      "lifecycle": "REJECTED",
      "classification": "GOVERNANCE",
      "source_path": ".ai/backlog/annexes/EPIC_Proposition_Architecture_IA_RAG.md",
      "active_runtime_path": null,
      "opened_at": "2026-06-30",
      "last_moved_at": "2026-07-01",
      "routing_decision": "annexe",
      "routing_reason": "Useful governance/RAG proposal, but not required to advance the current runtime mainline.",
      "moved_by": "ai",
      "blocks_mainline": false,
      "advances_mainline": false,
      "closure_reason": "Fichier source supprime manuellement par l'humain le 2026-07-01; plan rejete avant execution.",
      "non_goals": [
        "No Protocole/ frontmatter insertion in this governance reorg lot",